{
  "$schema": "../../../schema/psychometric_analysis_plan.schema.json",
  "analysis_plan_schema_version": "v0.1.0",
  "plan_id": "anx_us_2026w08_full_domain_bridge_analysis_plan",
  "benchmark_version": "v0.8.0",
  "study_id": "anx_us_2026w08_full_domain_bridge",
  "registration": {
    "preregistration_path": "docs/preregistrations/anx_us_2026w08_full_domain_bridge.md",
    "analysis_plan_path": "analysis/v0.8/full_domain_bridge/wave8_analysis_plan.json",
    "authoritative_contract": true,
    "outcome_inspection_status": "not_inspected"
  },
  "required_inputs": [
    {
      "input_id": "wave_response_file",
      "path": "vendor_restricted/anx_us_2026w08_full_domain_bridge/wave_response.jsonl",
      "role": "Respondent-item file for the 24 co-administered Wave 8 full-domain bridge items, validated against schema/wave_response.schema.json before distributions, split assignment, factor models, reliability, IRT, DIF, invariance, anchor drift, latent correlations, or release decisions are estimated.",
      "required_fields": [
        "wave_id",
        "benchmark_version",
        "item_id",
        "item_version",
        "respondent_id_hash",
        "raw_response",
        "scored_value",
        "missingness_code",
        "event_id",
        "survey_weight",
        "domain_block_order",
        "item_order",
        "item_response_time_ms"
      ],
      "validation_rule": "All rows must use wave_id anx_us_2026w08_full_domain_bridge, benchmark_version v0.8.0, event_id no_event, and only the frozen 24 item IDs listed in this analysis plan and the v0.8.0 release manifest."
    },
    {
      "input_id": "respondent_covariate_file",
      "path": "vendor_restricted/anx_us_2026w08_full_domain_bridge/respondent_covariates.csv",
      "role": "Respondent-level analytic file containing eligibility, exclusions, split assignment strata, demographic variables, employment variables, AI exposure, relationship and caregiving variables, safety-relevant occupation flags, device and sample-source metadata, baseline anxiety, item and block order, paradata, and weights.",
      "required_fields": [
        "respondent_id_hash",
        "analytic_eligible",
        "age_group",
        "gender",
        "race_ethnicity",
        "education",
        "census_region",
        "employment_status",
        "occupation_group",
        "prior_ai_exposure_frequency",
        "ai_news_exposure_30d",
        "relationship_status",
        "caregiving_role",
        "urbanicity",
        "cyber_or_infrastructure_employment",
        "prior_ai_companion_use",
        "baseline_general_anxiety_2item_mean",
        "sample_source",
        "device_type",
        "domain_block_order",
        "efa_cfa_split",
        "final_weight"
      ],
      "validation_rule": "Each eligible respondent must join to 24 administered item rows unless item missingness is explicitly coded, and all preregistered exclusion, split-stratification, DIF, invariance, weighting, and sensitivity variables must be present before outcome inspection."
    },
    {
      "input_id": "frozen_item_files",
      "path": "items",
      "role": "Frozen item wording, response anchors, scoring keys, construct metadata, exclusion metadata, validation metadata, and release status for all Wave 8 full-domain bridge items across the seven registered constructs.",
      "required_fields": [
        "sleep_disruption_ai_news",
        "body_vigilance_model_release",
        "background_dread_ai_progress",
        "avoidance_after_ai_capability_demo",
        "skill_obsolescence_software",
        "wage_pressure_customer_support",
        "retraining_pressure_accounting",
        "status_loss_creative_work",
        "deepfake_evidence_trust",
        "synthetic_news_provenance",
        "ai_expert_claim_conflict",
        "personalized_misinformation_targeting",
        "partner_ai_confidant_displacement",
        "friend_group_ai_mediation",
        "eldercare_ai_attachment_shift",
        "ai_personhood_boundary_uncertainty",
        "human_judgment_status_loss",
        "life_purpose_ai_substitution",
        "public_space_tracking",
        "workplace_behavior_scoring",
        "personalized_behavior_nudging",
        "autonomous_cyber_cascade",
        "biosecurity_protocol_misuse",
        "military_escalation_ai_advice"
      ],
      "validation_rule": "The analysis allowlist is exactly the 24 manifest item IDs: four somatic v0.2.0 anchor items, four economic v0.1.0 candidates, four epistemic v0.1.0 candidates, and twelve v0.8.0 candidates across relational, existential_identity, autonomy_surveillance, and safety_catastrophic domains."
    },
    {
      "input_id": "design_registry_files",
      "path": "releases/v0.8.0/manifest.json",
      "role": "Release-defining manifest, construct registry, sampling plan, no-event registry, preregistration, instrument, and codebook used to verify that all Wave 8 analyses match the frozen full-domain bridge packet.",
      "required_fields": [
        "benchmark_version",
        "release_status",
        "official_scored_items",
        "aggregate_scoring_permitted",
        "frozen_item_set",
        "checksums"
      ],
      "validation_rule": "The manifest must validate as v0.8.0 frozen_candidate, list no official scored items, prohibit aggregate scoring, checksum this analysis plan and the psychometric analysis plan schema, and match the preregistered no_event status."
    }
  ],
  "software_environment": {
    "language": "R",
    "runtime_version": "R 4.4.3",
    "packages": [
      {
        "name": "psych",
        "version": "2.4.12",
        "purpose": "Polychoric correlations, ordinal EFA, parallel analysis, item-total diagnostics, omega summaries, and descriptive item diagnostics."
      },
      {
        "name": "GPArotation",
        "version": "2024.3-1",
        "purpose": "Oblique rotations for seven-domain exploratory factor analysis and cross-loading review."
      },
      {
        "name": "lavaan",
        "version": "0.6-19",
        "purpose": "Ordered-categorical CFA, correlated seven-factor models, unidimensional and collapsed-domain comparison models, bifactor sensitivity models, and multi-group invariance using WLSMV."
      },
      {
        "name": "semTools",
        "version": "0.5-6",
        "purpose": "Ordinal reliability, measurement-invariance summaries, model comparison tables, and standardized loading extraction."
      },
      {
        "name": "mirt",
        "version": "1.43",
        "purpose": "Multidimensional graded-response IRT calibration, item information, local dependence, linking standard errors, DIF sensitivity, and somatic anchor drift estimates."
      },
      {
        "name": "lordif",
        "version": "0.3-3",
        "purpose": "Ordinal logistic DIF screening with Benjamini-Hochberg control and practical effect-size diagnostics."
      },
      {
        "name": "survey",
        "version": "4.4-2",
        "purpose": "Weighted descriptive distributions, weight diagnostics, weighted sensitivity summaries, and subgroup disclosure checks."
      },
      {
        "name": "mice",
        "version": "3.16.0",
        "purpose": "Covariate-only missingness sensitivity for non-ANX predictors; ANX item responses, scores, exclusions, split assignment, and event fields are never imputed."
      }
    ],
    "version_lock_rule": "Analyses must archive sessionInfo output and exact package versions. Any substitution requires a preregistered addendum showing unchanged confirmatory pass-fail decisions before observed Wave 8 evidence is used."
  },
  "randomization_and_seeds": {
    "global_seed": 20260816,
    "procedure_seeds": {
      "split_assignment": 20260817,
      "block_order_audit": 20260818,
      "efa_parallel_analysis": 20260819,
      "efa_bootstrap_stability": 20260820,
      "cfa_start_values": 20260821,
      "omega_bootstrap": 20260822,
      "irt_calibration": 20260823,
      "irt_linking": 20260824,
      "dif_resampling": 20260825,
      "invariance_start_values": 20260826,
      "latent_correlation_bootstrap": 20260827,
      "anchor_drift_bootstrap": 20260828,
      "weighting_sensitivity": 20260829
    },
    "seed_policy": "Seeds are fixed before outcome inspection, set immediately before stochastic procedures, and written to the Wave 8 evidence file with the exact R session lock and split-assignment audit."
  },
  "sample_splits": [
    {
      "split_id": "efa_split",
      "role": "development_pilot",
      "target_n": 1250,
      "overlap_rule": "The EFA split is randomly assigned from analytically eligible Wave 8 respondents before outcome inspection, stratified by sample source, device category, and domain-block order, and must not include known duplicate or pilot respondents when protected linkage is available.",
      "allowed_analyses": [
        "item_distributions",
        "efa",
        "parallel_analysis",
        "threshold_screening",
        "local_dependence_screening",
        "item_retention_recommendation"
      ]
    },
    {
      "split_id": "cfa_split",
      "role": "confirmation_sample",
      "target_n": 1250,
      "overlap_rule": "The CFA split is held out from EFA decisions until the EFA retention recommendation is archived, and it is the only split used for primary CFA, omega, IRT, DIF, invariance, latent-correlation, anchor-drift, and bridge-readiness pass-fail decisions.",
      "allowed_analyses": [
        "cfa",
        "omega",
        "irt",
        "dif",
        "invariance",
        "latent_correlations",
        "somatic_anchor_drift",
        "aggregate_readiness",
        "overall_readiness_review"
      ]
    }
  ],
  "eligibility_and_exclusions": {
    "eligibility_rules": [
      {
        "rule_id": "adult_us_english_consent",